id,nom,enseigne,adresse,ville,latitude,longitude,gasoil,essence,date_extraction
1,TotalEnergies DAR CHEMS,TotalEnergies,"Bd de la Grande Ceinture, Casablanca 20570",Casablanca,33.5827436,-7.5588149,10.0,12.76,2026-04-29T10:00:32.852824
2,Station Shell,Shell,Ait Ishaq، Boulevard Aïn Taoujtate، Casablanca 20250,Casablanca,33.5731104,-7.5898434,15.67,16.0,2026-04-29T10:00:32.852853
3,OLA ENERGY MASSIRA,OLA Energy,"AV MohV, ROUTE DE CASABLANCA, Rabat",Casablanca,33.975408,-6.878484,15.57,15.0,2026-04-29T10:00:32.852861
4,OLA ENERGY RADIO,OLA Energy,"QUARTIER TSF, ROUTE DE CASABLANCA, Rabat",Casablanca,34.000827,-6.860244,15.5,15.5,2026-04-29T10:00:32.852864
5,Winxo,Winxo,"X4PJ+J3G Winxo, Av. Hassan II, Rabat",Rabat,33.9865566,-6.8698105,10.0,,2026-04-29T10:00:32.852867
6,Station Service Afriquia,Afriquia,"Av. Al Melia, Rabat 10100",Rabat,33.9689066,-6.8641802,15.62,,2026-04-29T10:00:32.852870
7,Station Service Afriquia,Afriquia,"Station Service Afriquia، N1، Km 7 Rte de Rabat, Casablanca 20250",Casablanca,33.6039229,-7.5475017,20.0,16.0,2026-04-29T10:00:32.852874
8,Afriquia MARCHE DE GROS,Afriquia,"Abdelkader Essahraoui, Av. du 10 Mars 1982, Casablanca 20670",Casablanca,33.5509059,-7.5516237,20.0,17.0,2026-04-29T10:00:32.852876
9,Station Service Total,TotalEnergies,"G894+PJW Station Service Total, Casablanca",Casablanca,33.5193733,-7.6934299,,,2026-04-29T10:00:32.852879
10,TotalEnergies ALMA,TotalEnergies,"185 Bd de Bordeaux, Casablanca 20250",Casablanca,33.5992704,-7.6351877,,,2026-04-29T10:00:32.852881
11,Station Petrom,Petromin,"H9PC+954 Station Petrom, Casablanca 20250",Casablanca,33.58588,-7.6295405,12.0,10.0,2026-04-29T10:00:32.852884
12,TotalEnergies Racine,TotalEnergies,"Rond Point, Bd Mohammed Zerktouni, Casablanca 20250",Casablanca,33.5906163,-7.6359808,,,2026-04-29T10:00:32.852886
13,Station-service TotalEnergies Grande Ceinture,TotalEnergies,"Angle Bd de la Grande Ceinture, Casablanca 20250",Casablanca,33.5889332,-7.5454911,,,2026-04-29T10:00:32.852888
14,Station Shell El Manar,Shell,"Bd Brahim Roudani, Casablanca 20100",Casablanca,33.577723,-7.637705,,11.0,2026-04-29T10:00:32.852891
15,TotalEnergies VELODROME,TotalEnergies,"Bd Moulay Rachid, Casablanca 20250",Casablanca,33.5893929,-7.6487652,14.51,,2026-04-29T10:00:32.852893
16,TotalEnergies AL MADINA,TotalEnergies,"Bd Moulay Idriss I, Casablanca 20250",Casablanca,33.5748492,-7.6102065,,10.86,2026-04-29T10:00:32.852897
17,Station d'essence Shell Feth,Shell,"H9JG+X89 Station d'essence Shell Feth, Casablanca 20250",Casablanca,33.5824169,-7.6241523,,,2026-04-29T10:00:32.852900
18,Station Shell,Shell,"Av. 2 Mars, Casablanca 20250",Casablanca,33.5663547,-7.6095628,15.0,,2026-04-29T10:00:32.852902
19,Shell Doumer,Shell,"Avicenne / Alexandre 1Er، Boulevard Abdelkrim Al Khattabi, Casablanca 20250",Casablanca,33.5867117,-7.6491851,,,2026-04-29T10:00:32.852905
20,TotalEnergies CITEE DJEMAA,TotalEnergies,"Bd Commandant Driss Al Harti, Casablanca",Casablanca,33.5482294,-7.5733595,,,2026-04-29T10:00:32.852907
21,TotalEnergies ROUTE DU SUD,TotalEnergies,"Bd Brahim Roudani, Casablanca",Casablanca,33.57218,-7.64222,,,2026-04-29T10:00:32.852909
22,TotalEnergies AL AMAL,TotalEnergies,"Km 42, TotalEnergies AL AMAL, Boulevard Emille Zola, Route Azemmour, Casablanca 20250",Casablanca,33.5950675,-7.594424,,,2026-04-29T10:00:32.852911
23,Station Service Shell,Shell,"Rte d'El Jadida, Casablanca",Casablanca,33.558295,-7.6449069,,,2026-04-29T10:00:32.852914
24,TotalEnergies EL FARAH,TotalEnergies,"Bd de la Grande Ceinture, Casablanca 20320",Casablanca,33.5664034,-7.5849457,,,2026-04-29T10:00:32.852916
25,TotalEnergies M'DAKRA,TotalEnergies,"Bd Oqba Bnou Nafii, Casablanca 20670",Casablanca,33.5763401,-7.5487707,,,2026-04-29T10:00:32.852918
26,TotalEnergies RELAIS CHAOUIA,TotalEnergies,"vers Marrakech, Bd El Fida PK 35, Casablanca 20320",Casablanca,33.5730992,-7.589834,,,2026-04-29T10:00:32.852920
27,TotalEnergies Liberté,TotalEnergies,"345 Bd Oqba Bnou Nafii, Casablanca 20250",Casablanca,33.5808449,-7.5643726,,,2026-04-29T10:00:32.852923
28,TotalEnergies MY DRISS,TotalEnergies,"Av. 2 Mars, Bd Moulay Idriss I, Casablanca 20250",Casablanca,33.572108,-7.6141252,,,2026-04-29T10:00:32.852925
29,Shell Station Service Flahi,Shell,"Shell Station Service Flahi، Avenue Khaider Ben Abdellah، Av C, Casablanca 20250",Casablanca,33.5738118,-7.5541726,,,2026-04-29T10:00:32.852928
30,TotalEnergies Al Massira,TotalEnergies,"87 Bd Al Massira Al Khadra, Casablanca 20100",Casablanca,33.5870654,-7.6412924,,,2026-04-29T10:00:32.852932
31,TotalEnergies Route de Rabat,TotalEnergies,"JF32+52G TotalEnergies Route de Rabat, Casablanca 20250",Casablanca,33.602943,-7.5499078,12.8,,2026-04-29T10:00:32.852934
32,station d'essence Shell,Shell,"H9V5+VRH station d'essence Shell, Casablanca 20250",Casablanca,33.5946982,-7.6403754,,,2026-04-29T10:00:32.852937
33,Station Service Ziz,Autre,"H978+CFJ Station Service Ziz, Casablanca",Casablanca,33.5635822,-7.6338485,,,2026-04-29T10:00:32.852939
34,TotalEnergies EL GHOUROUB,TotalEnergies,"61 Bd de Bordeaux, Casablanca 20250",Casablanca,33.5972477,-7.6290221,,,2026-04-29T10:00:32.852941
35,Station Shell Essalam,Shell,"19 Av. Pasteur, Casablanca 20250",Casablanca,33.596392,-7.598669,15.5,,2026-04-29T10:00:32.852944
36,PLATINIUM SERVICES AUTO,Autre,N° 44 Rue 177 GR I - Oulfa Casablanca blanca,Casablanca,33.5521001,-7.6770715,,,2026-04-29T10:00:32.852947
37,TotalEnergies RIVIERA,TotalEnergies,"Rue Omar Al Khayam, Rte d'El Jadida, Casablanca 20250",Casablanca,33.5681994,-7.6447303,,,2026-04-29T10:00:32.852949
38,Station service Total,TotalEnergies,"HF29+RWJ Station service Total, Casablanca",Casablanca,33.5520751,-7.5302485,,,2026-04-29T10:00:32.852951
39,Station-service Shell,Shell,"Boulevard Ibn Tachfine, Boulevard Mohamed V, Casablanca 20250",Casablanca,33.5876554,-7.5987377,,,2026-04-29T10:00:32.852953
40,Station Service AM Petro Service,Autre,29 Rue Chahrour، Casablanca 20250,Casablanca,33.5610404,-7.646704,,,2026-04-29T10:00:32.852956
41,OLA ENERGY 2000 SIDI OTHMANE,OLA Energy,"Boulevard Driss EL Harti, Casablanca 20670",Casablanca,33.554055,-7.562783,,,2026-04-29T10:00:32.852959
42,TotalEnergies ETTAJ,TotalEnergies,"Boulevard Ibn Al Ouanane, Rue Marinie, Casablanca 20250",Casablanca,33.595597,-7.5638082,,,2026-04-29T10:00:32.852961
43,Station Shell Oulad Hriz,Shell,"Boulevard Mohammed VI, Route Mediouna, Casablanca 20100",Casablanca,33.568175,-7.596221,,,2026-04-29T10:00:32.852968
44,Station de Service Winxo,Winxo,"H9X9+FGR Station de Service Winxo, Bd de Bordeaux, Casablanca 20250",Casablanca,33.5987497,-7.6312263,,,2026-04-29T10:00:32.852971
45,Station Shell,Shell,"Station Shell، Boulevard Mohammed VI، Route Mediouna, Casablanca 20000",Casablanca,33.5453807,-7.5836025,,,2026-04-29T10:00:32.852974
46,Station Shell,Shell,"Station Shell، Boulevard de la Grande Ceinture، Omar Ibn Khattab, Casablanca 20320",Casablanca,33.567662,-7.582276,,,2026-04-29T10:00:32.852977
47,Station Service Winxo Avenir,Winxo,"H944+V25 Station Service Winxo Avenir, Casablanca 20000",Casablanca,33.5571477,-7.6448784,,,2026-04-29T10:00:32.852979
48,AZNAG,Autre,"Bd de Bordeaux, Casablanca 20250",Casablanca,33.5994138,-7.6351742,,,2026-04-29T10:00:32.852982
49,TotalEnergies VILLE NOUVELLE,TotalEnergies,"Cité Nouvelle de, Av. du 10 Mars 1982 Tranche D, Casablanca 20670",Casablanca,33.5567056,-7.5596302,,,2026-04-29T10:00:32.852985
50,Station Shell,Shell,"Bd Mohamed Zerktouni, Casablanca 20250",Casablanca,33.6012397,-7.6394591,,,2026-04-29T10:00:32.852987
51,TotalEnergies ABDELMOUMEN,TotalEnergies,"212 Bd Abdelmoumen, Casablanca 20250",Casablanca,33.572989,-7.6261113,,,2026-04-29T10:00:32.852989
52,Station Service Afriquia,Afriquia,Douar، A1 Autoroute De Contournement De Casablanca، Casablanca 20260,Casablanca,33.5111955,-7.610025,,,2026-04-29T10:00:32.852992
53,TotalEnergies MOUSTAKBAL,TotalEnergies,"868 Bd Mohammed VI, Casablanca 20250",Casablanca,33.5685203,-7.5962642,,,2026-04-29T10:00:32.852994
54,Station Service Petromin Oils,Petromin,"G9XG+QR8 Station Service Petromin Oils, Rte de Taddart, Casablanca",Casablanca,33.5494116,-7.6229323,,,2026-04-29T10:00:32.852997
55,TotalEnergies AIN SEBAA,TotalEnergies,"Pk 7, TotalEnergies AIN SEBAA, Rte de Rabat, Casablanca 20400",Casablanca,33.6039605,-7.5448664,,,2026-04-29T10:00:32.852999
56,OLA ENERGY CENTRE CASA,OLA Energy,302 Boulevard Mohamed V، Casablanca 20250,Casablanca,33.593372,-7.603382,,,2026-04-29T10:00:32.853004
57,Station Shell,Shell,"Rte d'El Jadida, Casablanca 20000",Casablanca,33.5579409,-7.6441428,,,2026-04-29T10:00:32.853007
58,Station shell Californie,Autre,"Prefecture Des Arrondissements، Av. Taddart, Casablanca",Casablanca,33.535334,-7.617007,,16.69,2026-04-29T10:00:32.853010
59,TotalEnergies ZI AIN SEBAA,TotalEnergies,"Q.I Oukacha, Rue El Haouza, Casablanca 20250",Casablanca,33.608013,-7.5579004,,,2026-04-29T10:00:32.853012
60,Shell Station Taddart,Shell,"Route de Taddart, Casablanca 20000",Casablanca,33.556148,-7.624233,14.5,,2026-04-29T10:00:32.853014
61,Station Service Ziz,Autre,"H9FM+HPV Station Service Ziz, Av. 2 Mars, Casablanca 20250",Casablanca,33.5739976,-7.615717,10.0,,2026-04-29T10:00:32.853017
62,Station Winxo,Winxo,"HCP2+569 Station Winxo, Casablanca 20250",Casablanca,33.5854073,-7.5993894,,,2026-04-29T10:00:32.853019
63,Shell station,Shell,"Bd Oqba Bnou Nafii, Casablanca 20250",Casablanca,33.5804278,-7.5613591,,,2026-04-29T10:00:32.853021
64,TotalEnergies OULED ZIANE,TotalEnergies,"Bd Ibn Tachfine, Casablanca 20320",Casablanca,33.5851644,-7.5753915,,,2026-04-29T10:00:32.853023
65,Station Service Afriquia,Afriquia,"Station Service Afriquia، Centre Commercial، Rue du Sergent Azdam Driss, Bd Ibn Tachfine, Casablanca 20250",Casablanca,33.585151,-7.5927253,15.0,,2026-04-29T10:00:32.853187
66,Shell Oasis,Shell,"Rte d'El Jadida, Casablanca 20410",Casablanca,33.566582,-7.64466,,,2026-04-29T10:00:32.853190
67,Station Service Winxo,Winxo,"H9GR+X35 Station Service Winxo, Casablanca 20250",Casablanca,33.577377,-7.609768,,,2026-04-29T10:00:32.853192
68,Station Total Mamounia,TotalEnergies,"Rue Bachir Ibrahimi, Casablanca 20250",Casablanca,33.5825093,-7.6021645,,,2026-04-29T10:00:32.853194
69,Station Shell,Shell,"Driss 1، Bd Abdelmoumen, Casablanca 20250",Casablanca,33.5718725,-7.6256385,,,2026-04-29T10:00:32.853200
70,Station Service Petromin Oils,Petromin,"HF67+683 Station Service Petromin Oils, Av. Abdelkader Essahraoui, Casablanca 20670",Casablanca,33.5605069,-7.5366957,,,2026-04-29T10:00:32.853202
71,TotalEnergies SIDI MAAROUF,TotalEnergies,"Centre Quartier, Av. Abou Bakr el Kadiri, Km7 Rte de Bouskoura, Casablanca 20280",Casablanca,33.515828,-7.6549907,15.5,,2026-04-29T10:00:32.853204
72,Station petrom,Autre,"JF5H+MGP Station petrom, Casablanca 20250",Casablanca,33.6092041,-7.5211588,,,2026-04-29T10:00:32.853207
73,TotalEnergies AIN MAAZI,TotalEnergies,"28 Bd de la Résistance, Casablanca 20250",Casablanca,33.5948333,-7.6037479,,,2026-04-29T10:00:32.853209
74,Station shell,Autre,"HCMQ+XQG Station shell, Bd Zouhair Mohamed Najjar, Casablanca 20670",Casablanca,33.5849382,-7.5605427,,,2026-04-29T10:00:32.853212
75,Station winxo وينكسو,Autre,Casablanca 20250,Casablanca,33.5805516,-7.5637275,,,2026-04-29T10:00:32.853215
76,ALLO NORA,Autre,"84 Bd Moulay Idriss I, Casablanca 20250",Casablanca,33.5724398,-7.617519,,,2026-04-29T10:00:32.853217
77,TotalEnergies GARAGE ES SAADA,TotalEnergies,"Industrielle, Rue Ecole, Casablanca 20000",Casablanca,33.5464661,-7.5912395,,,2026-04-29T10:00:32.853220
78,Station Service Petromin Oils,Petromin,Casablanca 20670,Casablanca,33.5652929,-7.5568071,12.94,13.94,2026-04-29T10:00:32.853222
79,Station Shell,Shell,"296 Bd El Fida, Casablanca 20250",Casablanca,33.5691431,-7.6032721,,,2026-04-29T10:00:32.853224
80,STATION DAKAR,Autre,"rond point chimicolor, 112 Bd de la Résistance, Casablanca 14383",Casablanca,33.5900651,-7.6038946,,,2026-04-29T10:00:32.853227
81,station shell Grande Route,Autre,"P3006, Casablanca 20250",Casablanca,33.6009802,-7.5144997,,,2026-04-29T10:00:32.853230
82,Espace faidi,Autre,"Unnamed Road, Casablanca, 20250",Casablanca,33.5659463,-7.562771,,,2026-04-29T10:00:32.853232
83,Station Shell,Shell,Boulevard Emile Zola، Casablanca 20000,Casablanca,33.585938,-7.584406,,,2026-04-29T10:00:32.853237
84,Station Service Afriquia,Afriquia,"Bd Moulay Slimane, Casablanca 20290",Casablanca,33.6108424,-7.5634504,,,2026-04-29T10:00:32.853239
85,Afriquia GRANDE CEINTURE I,Afriquia,"120 Bd de la Grande Ceinture, Casablanca 20250",Casablanca,33.5941606,-7.5451923,11.0,,2026-04-29T10:00:32.853242
86,station service Petromin Hay Al Inara,Petromin,"GCM2+HJ6 station service Petromin Hay Al Inara, Casablanca",Casablanca,33.5339188,-7.5984973,,,2026-04-29T10:00:32.853244
87,Station TOTAL - Attacharouk,Autre,"HFCC+W7C Station TOTAL - Attacharouk, Bd Oqba Bnou Nafii, Casablanca 20402",Casablanca,33.5723028,-7.529355,,,2026-04-29T10:00:32.853247
88,TotalEnergies ROCHES NOIRES,TotalEnergies,"Boulevard de l, Bd Moulay Slimane, Casablanca 20290",Casablanca,33.599856,-7.5886286,,,2026-04-29T10:00:32.853249
89,Station service Shell AlYassir (Electrique véhicule),Shell,"N1, Casablanca 20250",Casablanca,33.5929405,-7.5984936,,,2026-04-29T10:00:32.853251
90,Station Petrom,Petromin,"HC4G+9WQ Station Petrom, Casablanca",Casablanca,33.5559524,-7.5726525,,,2026-04-29T10:00:32.853254
91,Station Shell Des Stades (Ahmed Kessab),Shell,"400 Route El Jadida, Casablanca 20100",Casablanca,33.5583749,-7.6449509,,,2026-04-29T10:00:32.853256
92,Station Service Afriquia,Afriquia,"Station Service Afriquia، Cidana Ex Usine De Cirage, Bd Moulay Ismaïl, Casablanca 20290",Casablanca,33.5996046,-7.5699628,,,2026-04-29T10:00:32.853259
93,Station PETROM el amane,Autre,"HCJP+5PQ Station PETROM el amane, Daourat Mdakra, Casablanca 20670",Casablanca,33.5804625,-7.5631267,,,2026-04-29T10:00:32.853264
94,Petromin Station Taddart,Petromin,"route taddert hay bachkou ss bachkou 20000 casablanca el maarif maroc, Casablanca 20000",Casablanca,33.5558873,-7.6237322,,,2026-04-29T10:00:32.853266
95,Winxo,Winxo,"H9P8+RXV Winxo, Bd Mohammed Zerktouni, Casablanca 20250",Casablanca,33.5871187,-7.6325664,,,2026-04-29T10:00:32.853269
96,Station Winxo Les Allies,Winxo,"H9QR+VP8 Station Winxo Les Allies, Boulevard Mohamed Smiha, Casablanca 20250",Casablanca,33.5896542,-7.6081704,,,2026-04-29T10:00:32.853273
97,Station Shell,Shell,"Bd Moulay Ismaïl, Casablanca 20250",Casablanca,33.5982359,-7.5759235,,,2026-04-29T10:00:32.853276
98,TotalEnergies PALMIERS,TotalEnergies,"Rue Mohamed Bahi, Angle Bd 9 Avril, Casablanca",Casablanca,33.5807542,-7.6318209,,,2026-04-29T10:00:32.853278
99,Station Service inov,Autre,"G83R+CC2 Station Service inov, Casablanca",Casablanca,33.5035119,-7.6589704,,,2026-04-29T10:00:32.853281
100,Station Service Afriquia,Afriquia,"Boulevard Mohamed Zefzaf Quartier, Casablanca 20400",Casablanca,33.5885465,-7.4987788,,,2026-04-29T10:00:32.853283
101,Station Service Afriquia Panoramique,Afriquia,"Angle Boulevard Al Houceima_Et, Bd Panoramique, Casablanca",Casablanca,33.5498585,-7.6158781,15.0,,2026-04-29T10:00:32.853285
102,Station Service Afriquia,Afriquia,"120 Bd de la Grande Ceinture, Casablanca 20590",Casablanca,33.5955974,-7.5451633,,,2026-04-29T10:00:32.853288
103,العجلات.سباتة. جميلة.5.شارع.الداخلة.رقم.546.البيضاء,Autre,"rue dakhla n' 546 sbata Djemaa, Casablanca",Casablanca,33.5468948,-7.571254,6.0,,2026-04-29T10:00:32.853291
104,Station Service Afriquia,Afriquia,"Bd de la Résistance, Casablanca 20250",Casablanca,33.5838726,-7.6117361,,,2026-04-29T10:00:32.853293
105,Station Service Afriquia,Afriquia,"Bd Abdelmoumen, Casablanca 20250",Casablanca,33.5661558,-7.6267057,,,2026-04-29T10:00:32.853296
106,Station Oilibya,Autre,"Bd Amr Ibnou Ass, Casablanca 20250",Casablanca,33.5980795,-7.5819343,,,2026-04-29T10:00:32.853299
107,Afriquia OTHMANIA,Afriquia,"Bd Abou Houraïra, Casablanca 20450",Casablanca,33.559228,-7.576167,,,2026-04-29T10:00:32.853301
108,Total Maroc (Standard),TotalEnergies,"Sidi Belyout Quartier Alsace Orraine Boulevard Zer, Nador, Casablanca 20100",Casablanca,33.596457,-7.615478,,,2026-04-29T10:00:32.853303
109,Station Petrom,Petromin,"14 Rue Capitaine Bousserghine Hammadi, Casablanca 20100",Casablanca,33.5880026,-7.6020582,,,2026-04-29T10:00:32.853308
110,Luxeauto spa,Autre,"462 Av. du 6 Novembre 1975, Casablanca",Casablanca,33.5516499,-7.5810862,,,2026-04-29T10:00:32.853310
111,PRISSING MODERNE,Autre,"Derb Foukara rue17, N1, Casablanca 20250",Casablanca,33.5652806,-7.6058526,,,2026-04-29T10:00:32.853313
112,Shell,Shell,"Ile De France، Rue d'Ifrane, Casablanca 20250",Casablanca,33.5732486,-7.6558154,,,2026-04-29T10:00:32.853315
113,Station Service Afriquia,Afriquia,"Station Service Afriquia، Av. Abou Bakr el Kadiri Centre Commercial Bouskoura Sidi Maârouf Casablanca 9, Casablanca 20103",Casablanca,33.5371293,-7.6424781,,,2026-04-29T10:00:32.853319
114,Station Service Afriquia,Afriquia,"Rte de Chabbou, Casablanca 20250",Casablanca,33.5965325,-7.5307635,,,2026-04-29T10:00:32.853321
115,Shell Gas station,Shell,"Bd Ibn Al Ouanane, Casablanca 20250",Casablanca,33.5950589,-7.5691552,,,2026-04-29T10:00:32.853324
116,"Station Shell Hassania, Hay Hassani.",Shell,"Croisement Boulevard Sidi Abderrahmane et, Bd Ibnou Sina, Casablanca 20204",Casablanca,33.5714223,-7.6688121,,15.51,2026-04-29T10:00:32.853327
117,Station-service Winxo,Winxo,"H9MG+5MX Station-service Winxo, Casablanca 20250",Casablanca,33.582975,-7.6232692,,,2026-04-29T10:00:32.853329
118,Station Ola,Autre,"GCV8+WQG Station Ola, Bd Mohammed VI, Casablanca",Casablanca,33.5448177,-7.5830469,14.0,,2026-04-29T10:00:32.853331
119,Station winxo bizancy,Autre,"2 Rue de Rocroy, Casablanca 20250",Casablanca,33.5968476,-7.5956039,,,2026-04-29T10:00:32.853334
120,Station Shell Moulay Youssef,Shell,"Bd Moulay Youssef, Casablanca 20100",Casablanca,33.6016807,-7.6331372,,,2026-04-29T10:00:32.853336
121,Station Service Winxo,Winxo,"1 Rue Marrakech Magazin 4 Residence Al Firdaws, Tanger",Tanger,35.769607,-5.804434,12.0,,2026-04-29T10:00:32.853339
122,Station Total will,TotalEnergies,"Av. Al Qods, Tangier 90060",Autre,35.73536,-5.801406,,,2026-04-29T10:00:32.853347
123,Shell,Shell,Boulevard Mohamed V، Tangier 90000,Autre,35.777432,-5.80531,,,2026-04-29T10:00:32.853358
124,Shell,Shell,"45 Av. Hassan II, Tangier 90000",Autre,35.782608,-5.818425,,,2026-04-29T10:00:32.853363
125,Station Total will,TotalEnergies,"Av. Moulay Rachid, Tangier 90090",Autre,35.743001,-5.866713,,,2026-04-29T10:00:32.853368
126,Shell gas station,Shell,"129 Rue de Fès, Tangier 90060",Autre,35.77232,-5.813952,,,2026-04-29T10:00:32.853377
127,Total,TotalEnergies,"Place de la Ligue Arabe, Av. Marrakech, Tangier 90060",Marrakech,35.769142,-5.803961,,,2026-04-29T10:00:32.853381
128,Afriquia MARJANE TANGER,Afriquia,"Afriquia MARJANE TANGER، Commune Urbaine De Tanger، N1, Tangier 90060",Tanger,35.747843,-5.842519,15.52,,2026-04-29T10:00:32.853386
129,محطة زيز,Autre,"P4HC+WWC محطة زيز، Avenue Moulay Ismail, Tanger",Tanger,35.729814,-5.87772,,,2026-04-29T10:00:32.853390
130,Shell,Shell,"Shell، Av. Al Farabi, Dcheira El Jihadia 80000",Autre,30.392748,-9.532403,,,2026-04-29T10:00:32.853400
131,Afriquia MARINA AGADIR,Afriquia,"Afriquia MARINA AGADIR، Rue Bourguignon, Av. Mohammed V, Agadir 80000",Agadir,30.426823,-9.61605,,,2026-04-29T10:00:32.853405
132,TotalEnergies Relais Agadir,TotalEnergies,"Pk 7, Avenue Mohammedia, Route d'Essaouira, Agadir",Agadir,30.428069,-9.563365,,,2026-04-29T10:00:32.853408
133,Station Service Petromin Oils,Petromin,"CC6F+RGQ Station Service Petromin Oils, Ave Abderrahim Bouabid, Agadir 80000",Agadir,30.412083,-9.576132,,,2026-04-29T10:00:32.853411
134,محطة بتروم,Autre,"9FRP+79H محطة بتروم، Av. Arraha, Agadir 80000",Agadir,30.390685,-9.514015,12.0,,2026-04-29T10:00:32.853416
135,Afriquia TADDART,Afriquia,"Afriquia TADDART، Taddard Marrakech، N1، 40 Rp, Agadir 80000",Agadir,30.432865,-9.574608,,,2026-04-29T10:00:32.853420
136,Station Service Winxo,Winxo,"CCG2+769 Station Service Winxo, Rue Des Nations Unies, Agadir 80000",Agadir,30.425652,-9.599387,,,2026-04-29T10:00:32.853425
137,محطة طوطال,Autre,"محطة طوطال، Rue de la Foire, Av. Hassan II, Agadir 80000",Agadir,30.418126,-9.596349,,,2026-04-29T10:00:32.853430
138,Station Service Winxo,Winxo,"Bd Abderrahim Bouabid, Agadir 80000",Agadir,30.41574,-9.566986,,11.0,2026-04-29T10:00:32.853433
139,محطة بتروم,Autre,"9FXF+FH6 محطة بتروم، N1, Agadir 80000",Agadir,30.398657,-9.52612,,,2026-04-29T10:00:32.853437
140,Afriquia MARJANE AGADIR,Afriquia,"Afriquia MARJANE AGADIR، Secteur J Commune Urbaine، N10 Lotissement Founty, Agadir 80000",Agadir,30.396272,-9.581753,,,2026-04-29T10:00:32.853442
141,Shell,Shell,"Shell، Avenue Hassan II، Angle Boulevard Med V, Agadir 80000",Agadir,30.408325,-9.588632,,,2026-04-29T10:00:32.853447
142,Shell,Shell,"Shell، Avenue Hassan II، Angle Rue Chouhada, Agadir 80000",Agadir,30.425079,-9.605935,,,2026-04-29T10:00:32.853451
143,Afriquia ALQODS,Afriquia,"Afriquia ALQODS، National Rte 1، Boulevard 358, Agadir 80000",Agadir,30.421168,-9.554536,,,2026-04-29T10:00:32.853455
144,TotalEnergies RELAIS AGADIR,TotalEnergies,"Sortie D'agadir, National Route 1, Avenue Ibn Alhaitame، Agadir 80070",Agadir,30.396986,-9.523893,,,2026-04-29T10:00:32.853462
145,OLA ENERGY ARFAA,OLA Energy,"B.P.366 Avenue Abderrahim Bouabid, Agadir 80000",Agadir,30.374454,-9.505063,,,2026-04-29T10:00:32.853465
146,محطة وينكسو,Autre,"CC65+VH3 محطة وينكسو، Bd Hassan II, Agadir 80000",Agadir,30.412131,-9.591082,,,2026-04-29T10:00:32.853469
147,Shell,Shell,"Shell، Vers Tikiouine، National Route 1 Route Express, Agadir 80000",Agadir,30.391411,-9.516626,,,2026-04-29T10:00:32.853473
148,Afriquia AGADIR VILLE,Afriquia,"Boulevard Mohammed Cheikh Saadi, Agadir 80000",Agadir,30.422304,-9.584256,,,2026-04-29T10:00:32.853476
149,Station Petrom,Petromin,"C9FX+53F Station Petrom, Bd Hassan II, Agadir 80000",Agadir,30.422937,-9.602344,,,2026-04-29T10:00:32.853482
150,TotalEnergies RIAD,TotalEnergies,"219 Avenue El Qods, Meknès 50030",Meknès,33.887006,-5.569865,,,2026-04-29T10:00:32.853487
151,Shell,Shell,Shell، R718 Route De Rabat، Meknès 50040,Rabat,33.888911,-5.582833,12.1,,2026-04-29T10:00:32.853490
152,Afriquia MARJANE MEKNES,Afriquia,"Afriquia MARJANE MEKNES، Guerroune Nord Commune Rurale Ait Oualal, P7017, Meknes 50050",Autre,33.855555,-5.579914,,,2026-04-29T10:00:32.853505
153,Total Petrol Station Sidi Said,TotalEnergies,"R718 Route de Rabat, Meknes 50030",Rabat,33.888305,-5.584603,,,2026-04-29T10:00:32.853507
154,station-service TotalEnergies Ismailiya,TotalEnergies,Meknès,Meknès,33.873016,-5.54073,,,2026-04-29T10:00:32.853511
155,Shell,Shell,"Shell، R718, Meknès 50000",Meknès,33.890304,-5.579053,,,2026-04-29T10:00:32.853515
156,Station Service Ziz,Autre,"N13, Meknès",Meknès,33.851391,-5.526598,,,2026-04-29T10:00:32.853519
157,Shell Station,Shell,"Rue Ibn Khaldoun, 9 Rue Bandang, Meknes 50000",Autre,33.89651,-5.542334,,,2026-04-29T10:00:32.853525
158,Station winxo,Autre,"VCVF+2QV Station winxo, Meknès",Meknès,33.892625,-5.575588,,,2026-04-29T10:00:32.853530
159,طوطال,Autre,"طوطال، Av. des F.A.R, Meknès 50010",Meknès,33.898001,-5.53358,,,2026-04-29T10:00:32.853535
160,Station Shell,Shell,"VCHQ+H2 Station Shell, Meknes",Autre,33.878937,-5.562437,,,2026-04-29T10:00:32.853540
161,Station Service Petrom,Petromin,"WG25+XX7 Station Service Petrom, Meknes",Autre,33.902421,-5.490085,,,2026-04-29T10:00:32.853545
162,Afriquia OUISSLANE 2,Afriquia,"Rte Principale Fès Meknès, Meknes 50045",Meknès,33.902695,-5.491989,10.0,,2026-04-29T10:00:32.853553
163,Station Petrom,Petromin,"VCR3+2XR Station Petrom, Meknès",Meknès,33.890114,-5.595107,,,2026-04-29T10:00:32.853557
164,SHELL,Autre,"N13, Meknes 50000",Autre,33.845948,-5.524068,,,2026-04-29T10:00:32.853562
165,Station Ziz,Autre,"Ave Allal El Fassi, Meknes",Autre,33.901428,-5.53346,,,2026-04-29T10:00:32.853568
166,Station Service Ziz,Autre,"RFRH+J4R Station Service Ziz, Rte d'Ifrane, Meknès",Meknès,33.84162,-5.522222,,,2026-04-29T10:00:32.853573
167,TotalEnergies IDRISSIA,TotalEnergies,"14 Ave Idriss II, Meknès 50000",Meknès,33.897202,-5.548307,,,2026-04-29T10:00:32.853578
168,TotalEnergies GHABA,TotalEnergies,"Bd Moulay Youssef, Meknès 50000",Meknès,33.89319,-5.542469,,,2026-04-29T10:00:32.853582
169,OLA ENERGY HABOUS,OLA Energy,"Av. des F.A.R, Meknès",Meknès,33.898223,-5.53129,,,2026-04-29T10:00:32.853586
170,TotalEnergies DOUANE,TotalEnergies,"Boulevard de l'Armée Royale, P1, Oujda",Oujda,34.691798,-1.907849,10.0,,2026-04-29T10:00:32.853592
171,Okay Energy Mansour Dahbi,Autre,"Boulevard Mansour Dahbi, Oujda 60000",Oujda,34.696626,-1.906923,,,2026-04-29T10:00:32.853596
172,Station Service Shell,Shell,"Station Service Shell، Rue Madina, Rue M Mounaouara, Oujda 60000",Oujda,34.685446,-1.914716,,,2026-04-29T10:00:32.853603
173,Shell,Shell,"Rue M Mounaouara Bd D'ahfir, Rue M Mounaouara, Oujda 60000",Oujda,34.69284,-1.918324,,,2026-04-29T10:00:32.853607
174,Shell,Shell,"Shell، Av. Yacoub Al Mansour, Oujda 60000",Oujda,34.666167,-1.897036,,,2026-04-29T10:00:32.853612
175,Station Service Winxo,Winxo,"M3J8+4P8 Station Service Winxo, Boulevard Mbarek Al Bekkay, Oujda",Oujda,34.680279,-1.933172,,,2026-04-29T10:00:32.853619
176,Station-service,Autre,"M4XV+V7 Station-service, Oujda",Oujda,34.699635,-1.857033,,,2026-04-29T10:00:32.853622
177,TotalEnergies AL MAKSSEM,TotalEnergies,"366 Rue Seloum, Oujda 34000",Oujda,34.668611,-1.897939,,,2026-04-29T10:00:32.853626
178,Station Service Winxo agdal oujda,Winxo,"Bd Brahim Roudani, Oujda 60020",Oujda,34.675153,-1.864058,,,2026-04-29T10:00:32.853629
179,Afriquia CARREFOUR OUJDA,Afriquia,"Centre Commercial Carrefour، Bd Mohammed VI, Oujda 34000",Oujda,34.660459,-1.906599,,,2026-04-29T10:00:32.853636
